{
  "$schema": "https://json-schema.org/draft/2020-12/schema",
  "title": "ORC constructed course, version 1",
  "description": "One course as ORC Rating Systems rule 402.5 defines a constructed course. See constructed-course-format.md beside this file.",
  "type": "object",
  "required": ["format", "version", "north", "legs"],
  "properties": {
    "format": { "const": "orc-constructed-course" },
    "version": { "const": 1 },
    "name": {
      "type": "string",
      "minLength": 1,
      "description": "The course's name, for people. Never matched against anything."
    },
    "north": {
      "const": "magnetic",
      "description": "Every direction in the document is in degrees magnetic: each leg's course, wind direction and current direction."
    },
    "anchor": {
      "$ref": "#/$defs/position",
      "description": "Where the first leg starts: the position its distance and course are measured from."
    },
    "legs": {
      "type": "array",
      "minItems": 1,
      "items": { "$ref": "#/$defs/leg" },
      "description": "The legs in sailing order, start to finish. The course length is their sum.",
      "allOf": [
        {
          "description": "The wind direction is on every leg or on none.",
          "anyOf": [
            { "items": { "required": ["windDirection"] } },
            { "items": { "not": { "required": ["windDirection"] } } }
          ]
        },
        {
          "description": "The wind speed is on every leg or on none.",
          "anyOf": [
            { "items": { "required": ["windSpeed"] } },
            { "items": { "not": { "required": ["windSpeed"] } } }
          ]
        }
      ]
    }
  },
  "$defs": {
    "direction": {
      "type": "number",
      "minimum": 0,
      "maximum": 360
    },
    "position": {
      "type": "object",
      "required": ["lat", "lng"],
      "properties": {
        "lat": { "type": "number", "minimum": -90, "maximum": 90 },
        "lng": { "type": "number", "minimum": -180, "maximum": 180 }
      }
    },
    "leg": {
      "type": "object",
      "required": ["distance", "course"],
      "properties": {
        "name": {
          "type": "string",
          "minLength": 1,
          "description": "The leg as the race committee labels it, e.g. \"Start – 1\"."
        },
        "distance": {
          "type": "number",
          "exclusiveMinimum": 0,
          "description": "Leg length in nautical miles, as finely as it was measured (to 0.01 NM at least). The course length is the sum of the legs, rounded to 0.01 NM."
        },
        "course": {
          "$ref": "#/$defs/direction",
          "description": "The leg's direction: the bearing from its start to its end, degrees magnetic."
        },
        "windDirection": {
          "$ref": "#/$defs/direction",
          "description": "The direction the true wind blows from on the leg, degrees magnetic."
        },
        "windSpeed": {
          "type": "number",
          "exclusiveMinimum": 0,
          "description": "The true wind speed the race committee recorded on the leg, in knots."
        },
        "currentDirection": {
          "$ref": "#/$defs/direction",
          "description": "The direction the current flows toward (its set), degrees magnetic."
        },
        "currentSpeed": {
          "type": "number",
          "minimum": 0,
          "description": "The current's rate, in knots."
        }
      },
      "dependentRequired": {
        "windSpeed": ["windDirection"],
        "currentDirection": ["currentSpeed"],
        "currentSpeed": ["currentDirection"]
      }
    }
  }
}
